<?xml version="1.0"?>
<?xml-stylesheet type="text/css" href="college.css"?>   

<!--sdhbbcs-->
<?xml-stylesheet type="text/xsl" href="sample.xsl"?>
<!-- <!DOCTYPE college SYSTEM "college.dtd"> -->
<college xmlns:xsi="http://www.w3.org/2001/XMLSchema-instance"
xsi:noNamespaceSchemaLocation="college.xsd">   
   <teach category="teaching">  
        <teaching>
        <name>Rohit Sir</name>
        <id>1</id>
        <dept>cse</dept>
        </teaching>
        <teaching>
        <name>Akhila mam</name>
        <id>1</id>
        <dept>cse</dept>
        </teaching>
        <teaching>
        <name>xyz</name>
        <id>1</id>
        <dept>cse</dept>
        </teaching>
   </teach>   
   <non-teach category="non-teaching">   
        <nonteaching>
        <name>xyz</name>
        <id>2</id>
        <dept>office staff</dept>
        </nonteaching>
        <nonteaching>
        <name>xyz</name>
        <id>2</id>
        <dept>office staff</dept>
        </nonteaching>
   </non-teach>   
   <student category="student">   
        <students>
           <name>gayathri</name>
            <roll>19-5p1</roll>
            <dept>cse</dept>
        </students>
        <students >
           <name>abc</name>
            <roll>19-5p1</roll>
            <dept>cse</dept>
        </students>
   </student>   
</college>  
